{
  "$schema": "https://json-schema.org/draft/2020-12/schema",
  "title": "banco.page_review/1",
  "description": "A review of a page revision by an independent session (D-290, SPEC B8): the 11 points and the findings by file.",
  "type": "object",
  "additionalProperties": false,
  "required": [
    "schema",
    "schema_version",
    "revision",
    "checklist",
    "findings"
  ],
  "properties": {
    "schema": {
      "const": "banco.page_review/1"
    },
    "schema_version": {
      "const": 1
    },
    "revision": {
      "type": "string",
      "minLength": 1,
      "maxLength": 64,
      "pattern": "^[A-Za-z0-9_-]+$"
    },
    "checklist": {
      "type": "array",
      "prefixItems": [
        {
          "type": "object",
          "additionalProperties": false,
          "required": [
            "id",
            "result",
            "evidence"
          ],
          "properties": {
            "id": {
              "const": 1
            },
            "result": {
              "enum": [
                "pass",
                "fail",
                "na"
              ]
            },
            "evidence": {
              "type": "string",
              "minLength": 12,
              "maxLength": 1200
            }
          }
        },
        {
          "type": "object",
          "additionalProperties": false,
          "required": [
            "id",
            "result",
            "evidence"
          ],
          "properties": {
            "id": {
              "const": 2
            },
            "result": {
              "enum": [
                "pass",
                "fail",
                "na"
              ]
            },
            "evidence": {
              "type": "string",
              "minLength": 12,
              "maxLength": 1200
            }
          }
        },
        {
          "type": "object",
          "additionalProperties": false,
          "required": [
            "id",
            "result",
            "evidence"
          ],
          "properties": {
            "id": {
              "const": 3
            },
            "result": {
              "enum": [
                "pass",
                "fail",
                "na"
              ]
            },
            "evidence": {
              "type": "string",
              "minLength": 12,
              "maxLength": 1200
            }
          }
        },
        {
          "type": "object",
          "additionalProperties": false,
          "required": [
            "id",
            "result",
            "evidence"
          ],
          "properties": {
            "id": {
              "const": 4
            },
            "result": {
              "enum": [
                "pass",
                "fail",
                "na"
              ]
            },
            "evidence": {
              "type": "string",
              "minLength": 12,
              "maxLength": 1200
            }
          }
        },
        {
          "type": "object",
          "additionalProperties": false,
          "required": [
            "id",
            "result",
            "evidence"
          ],
          "properties": {
            "id": {
              "const": 5
            },
            "result": {
              "enum": [
                "pass",
                "fail",
                "na"
              ]
            },
            "evidence": {
              "type": "string",
              "minLength": 12,
              "maxLength": 1200
            }
          }
        },
        {
          "type": "object",
          "additionalProperties": false,
          "required": [
            "id",
            "result",
            "evidence"
          ],
          "properties": {
            "id": {
              "const": 6
            },
            "result": {
              "enum": [
                "pass",
                "fail",
                "na"
              ]
            },
            "evidence": {
              "type": "string",
              "minLength": 12,
              "maxLength": 1200
            }
          }
        },
        {
          "type": "object",
          "additionalProperties": false,
          "required": [
            "id",
            "result",
            "evidence"
          ],
          "properties": {
            "id": {
              "const": 7
            },
            "result": {
              "enum": [
                "pass",
                "fail",
                "na"
              ]
            },
            "evidence": {
              "type": "string",
              "minLength": 12,
              "maxLength": 1200
            }
          }
        },
        {
          "type": "object",
          "additionalProperties": false,
          "required": [
            "id",
            "result",
            "evidence"
          ],
          "properties": {
            "id": {
              "const": 8
            },
            "result": {
              "enum": [
                "pass",
                "fail",
                "na"
              ]
            },
            "evidence": {
              "type": "string",
              "minLength": 12,
              "maxLength": 1200
            }
          }
        },
        {
          "type": "object",
          "additionalProperties": false,
          "required": [
            "id",
            "result",
            "evidence"
          ],
          "properties": {
            "id": {
              "const": 9
            },
            "result": {
              "enum": [
                "pass",
                "fail",
                "na"
              ]
            },
            "evidence": {
              "type": "string",
              "minLength": 12,
              "maxLength": 1200
            }
          }
        },
        {
          "type": "object",
          "additionalProperties": false,
          "required": [
            "id",
            "result",
            "evidence"
          ],
          "properties": {
            "id": {
              "const": 10
            },
            "result": {
              "enum": [
                "pass",
                "fail",
                "na"
              ]
            },
            "evidence": {
              "type": "string",
              "minLength": 12,
              "maxLength": 1200
            }
          }
        },
        {
          "type": "object",
          "additionalProperties": false,
          "required": [
            "id",
            "result",
            "evidence"
          ],
          "properties": {
            "id": {
              "const": 11
            },
            "result": {
              "enum": [
                "pass",
                "fail",
                "na"
              ]
            },
            "evidence": {
              "type": "string",
              "minLength": 12,
              "maxLength": 1200
            }
          }
        }
      ],
      "items": false,
      "minItems": 11,
      "maxItems": 11
    },
    "findings": {
      "type": "array",
      "maxItems": 30,
      "items": {
        "type": "object",
        "additionalProperties": false,
        "required": [
          "severity",
          "file",
          "quote",
          "problem_it",
          "fix_it"
        ],
        "properties": {
          "severity": {
            "enum": [
              "blocker",
              "major",
              "minor"
            ]
          },
          "file": {
            "type": "string",
            "minLength": 1,
            "maxLength": 120,
            "pattern": "^(?!.*\\.\\.)[A-Za-z0-9_][A-Za-z0-9_./-]*$"
          },
          "line": {
            "anyOf": [
              {
                "type": "null"
              },
              {
                "type": "integer",
                "minimum": 1,
                "maximum": 100000
              }
            ]
          },
          "quote": {
            "type": "string",
            "minLength": 1,
            "maxLength": 500
          },
          "problem_it": {
            "type": "string",
            "minLength": 1,
            "maxLength": 600
          },
          "fix_it": {
            "type": "string",
            "minLength": 1,
            "maxLength": 600
          }
        }
      }
    }
  }
}
